question,condition,variable,value,month,Mittelwert von value,Rating_in_relation_to_mean
Die Luft wurde hinter geatmet.,F,participant_126,1.0,März,3.65625,-2.65625
Der Stürmer hat den Torwart vorsätzlich und unsportlich gefoult.,F,participant_126,6.0,März,3.65625,2.34375
"Sie hofft, das Finanzamt hat den frechen und kriminellen Betrüger überlistet.",F,participant_126,6.0,März,3.65625,2.34375
Der Diamant ist von seltener Schön- und Reinheit.,H 1.3,participant_126,7.0,März,3.65625,3.34375
Der Anwalt setzt sich für die Frei- und Gleichheit aller Menschen ein.,H 1'.4,participant_126,7.0,März,3.65625,3.34375
"Er glaubt, dass die Staatsanwälte zu viel Befangen- und Verschwiegenheit an den Tag legen.",H 4.5,participant_126,1.0,März,3.65625,-2.65625
Eigenschaften wie Verderbt- und Lüsternheit sind absolut unpassend.,H 4'.6,participant_126,6.0,März,3.65625,2.34375
Das Hotel erfüllte ihre Erwartungen und überzeugte vor allem durch Sauber- und Gemütlichkeit.,K 2.1,participant_126,2.0,März,3.65625,-1.65625
Fachleute waren sich uneinig über die Wahrscheinlich- und Möglichkeit eines Wahlsieges.,K 2'.2,participant_126,3.0,März,3.65625,-0.65625
Die Feindselig- und Unfähigkeit der Angestellten ist aber alles andere als guter Service.,K 5.7,participant_126,1.0,März,3.65625,-2.65625
Für eine Sekunde war der Zauber von Unendlich- und Unsterblichkeit zu spüren.,K 5'.8,participant_126,7.0,März,3.65625,3.34375
Die Probleme sind vor allem zeit- und rechtlicher Natur.,L 2.1,participant_126,3.0,März,3.65625,-0.65625
Die Landschaft dort ist herr- und friedlich.,L 2'.2,participant_126,1.0,März,3.65625,-2.65625
Wir verwenden ausschließ- und ausdrücklich regionale Zutaten.,L 5.7,participant_126,6.0,März,3.65625,2.34375
Selbst für erfahrene Rettungskräfte war der Anblick sonder- und entsetzlich.,L 5'.8,participant_126,2.0,März,3.65625,-1.65625
Das Verhalten ist an Gemein- und Hässlichkeit nicht zu übertreffen.,Mis 3.3,participant_126,6.0,März,3.65625,2.34375
Der Papst erfreut sich großer Herrlich- und Berühmtheit.,Mis 3'.4,participant_126,2.0,März,3.65625,-1.65625
Sie strahlt Selbstsicher- und Glaubwürdigkeit aus.,Mis 6.1,participant_126,3.0,März,3.65625,-0.65625
Für Kinder sind Unabhängig- und Geborgenheit wichtig.,Mis 6'.2,participant_126,6.0,März,3.65625,2.34375
Bischöfe bestimmten die gött- und weltliche Ordnung.,Mix 3.3,participant_126,6.0,März,3.65625,2.34375
Oft ist mit dem mensch- und männlichen Körper ein und das Selbe gemeint.,Mix 3'.4,participant_126,1.0,März,3.65625,-2.65625
Nachhaltig zu leben ist natür- und verantwortlich.,Mix 6.1,participant_126,6.0,März,3.65625,2.34375
Mutproben sind schreck- und gefährlich.,Mix 6'.2,participant_126,2.0,März,3.65625,-1.65625
Der Pfarrer hat sie kürz- und irrtümlich kontaktiert.,U 1.3,participant_126,3.0,März,3.65625,-0.65625
Sie ist eher so der ängst- und häusliche Typ.,U 1'.4,participant_126,6.0,März,3.65625,2.34375
Sie stellen hauptsäch- und grundsätzlich Frauen ein.,U 4.5,participant_126,5.0,März,3.65625,1.34375
Die Bank will zusätz- und buchstäblich hundert tausend Euro.,U 4'.6,participant_126,1.0,März,3.65625,-2.65625
Nudeln sind der neue Reis.,Deutsch_test_2,participant_126,6.0,März,3.65625,2.34375
Reis ist die neuen Nudeln.,Deutsch_test_3,participant_126,2.0,März,3.65625,-1.65625
Die Katze wurde unter gestreichelt und gekrault.,F,participant_127,2.0,Dezember,4.733333333,-2.733333333
Der Polizist hat den komplizierten Fall endlich gelöst.,F,participant_127,7.0,Dezember,4.733333333,2.266666667
"Er weiß, der Mann hat das neue und teure Handy geklaut.",F,participant_127,3.0,Dezember,4.733333333,-1.733333333
"In Bayern meinte sie, haben die Lehrer die Schüler mehr unter Kontrolle.",F,participant_127,5.0,Dezember,4.733333333,0.26666666699999997
"Ihr fahrt gerne in die Berge, obwohl ihr wohnt sehr nahe am Meer.",F,participant_127,3.0,Dezember,4.733333333,-1.733333333
Da gelacht rüber hat der Moderator natürlich nicht.,F,participant_127,1.0,Dezember,4.733333333,-3.733333333
Ihr Auftreten strahlt Gewiss- und Sicherheit aus.,H 1.2,participant_127,4.0,Dezember,4.733333333,-0.733333333
Der Diamant ist von seltener Rein- und Schönheit.,H 1'.3,participant_127,6.0,Dezember,4.733333333,1.266666667
Eine Ausbildung in Frankreich steht für Gewandt- und Kultiviertheit.,H 4.8,participant_127,3.0,Dezember,4.733333333,-1.733333333
Sie strahlen Erhaben- und Vergangenheit aus.,H 4'.1,participant_127,5.0,Dezember,4.733333333,0.26666666699999997
Sie legt viel wert auf Höflich- und Pünktlichkeit.,K 2.4,participant_127,6.0,Dezember,4.733333333,1.266666667
Die Wichtig- und Richtigkeit der Erkenntnisse kann nicht oft genug betont werden.,K 2'.5,participant_127,6.0,Dezember,4.733333333,1.266666667
Jede Zeit kommt mit einer eigenen Idee von Männlich- und Weiblichkeit.,K 5.2,participant_127,6.0,Dezember,4.733333333,1.266666667
Die Erkenntnis über seine Gleichgültig- und Eitelkeit kam aber zu spät.,K 5'.3,participant_127,7.0,Dezember,4.733333333,2.266666667
Ihre Beziehung ist immer noch leidenschaft- und glücklich.,L 2.4,participant_127,5.0,Dezember,4.733333333,0.26666666699999997
Der Schraubenzieher ist hand- und dünnlich.,L 2'.5,participant_127,2.0,Dezember,4.733333333,-2.733333333
Seine Antwort war ehr- und erstaunlich.,L 5.2,participant_127,6.0,Dezember,4.733333333,1.266666667
weil er behilf- und niedlich ist.,L 5'.3,participant_127,6.0,Dezember,4.733333333,1.266666667
Die gute Zusammenarbeit basiert auf Vertraut- und Einigkeit.,Mis 3.6,participant_127,6.0,Dezember,4.733333333,1.266666667
Die Zuständig- und Begebenheiten in dem Fall sind noch nicht geklärt.,Mis 3'.7,participant_127,4.0,Dezember,4.733333333,-0.733333333
Vor lauter Beschränkt- und Bitterkeit hat der Nachbar keinen Kontakt zu den anderen.,Mis 6.4,participant_127,2.0,Dezember,4.733333333,-2.733333333
Sie strahlt Glaubwürdig- und Selbstsicherheit aus.,Mis 6'.1,participant_127,6.0,Dezember,4.733333333,1.266666667
Sie treffen sich täg- und heimlich.,Mix 3.6,participant_127,7.0,Dezember,4.733333333,2.266666667
Die Durchsuchung Mitten in der Nacht war amt- und gründlich.,Mix 3'.7,participant_127,6.0,Dezember,4.733333333,1.266666667
Der Auftritt war lächer- und peinlich.,Mix 6.4,participant_127,1.0,Dezember,4.733333333,-3.733333333
Nachhaltig zu leben ist verantwort- und natürlich.,Mix 6'.1,participant_127,5.0,Dezember,4.733333333,0.26666666699999997
wenn die jähr- und tödliche Malariasaison wieder vor der Tür steht.,U 1.2,participant_127,3.0,Dezember,4.733333333,-1.733333333
Seine Verteidigung war widersprüch- und jämmerlich.,U 4.8,participant_127,6.0,Dezember,4.733333333,1.266666667
Es schmeckt vorzüg- und köstlich.,U 4'.1,participant_127,6.0,Dezember,4.733333333,1.266666667
Reis ist die neuen Nudeln.,Deutsch_test_3,participant_127,7.0,Dezember,4.733333333,2.266666667
Auf allen Konzerten spielt die Band fehlerfrei.,F,participant_128,6.0,Juli,1.53125,4.46875
Wo hat die Feuerwehr welches Haus gelöscht?,F,participant_128,7.0,Juli,1.53125,5.46875
Du hast der Frau sich selbst als Beraterin vorgeschlagen.,F,participant_128,1.0,Juli,1.53125,-0.53125
Der Lehrer hat den Schülern es nachgetragen.,F,participant_128,2.0,Juli,1.53125,0.46875
"Die Firma sagt er, dass die Bestellung vergessen oder verloren hat.",F,participant_128,1.0,Juli,1.53125,-0.53125
Die Gruppe wurde hinter beschuldigt.,F,participant_128,1.0,Juli,1.53125,-0.53125
Allen war die Dumm- und Feigheit ihrer Entscheidung klar.,H 1.7,participant_128,1.0,Juli,1.53125,-0.53125
Viele streben innere Zufrieden- und Gelassenheit an.,H 1'.8,participant_128,1.0,Juli,1.53125,-0.53125
Sie strahlen Vergangen- und Erhabenheit aus.,H 4.1,participant_128,1.0,Juli,1.53125,-0.53125
Das Hotel bietet Abgeschieden- und Gelegenheit zum Entspannen.,H 4'.2,participant_128,1.0,Juli,1.53125,-0.53125
Das Hotel erfüllte ihre Erwartungen und überzeugte vor allem durch Sauber- und Gemütlichkeit.,K 2.1,participant_128,1.0,Juli,1.53125,-0.53125
Fachleute waren sich uneinig über die Wahrscheinlich- und Möglichkeit eines Wahlsieges.,K 2'.2,participant_128,1.0,Juli,1.53125,-0.53125
Die Erkenntnis über seine Eitel- und Gleichgültigkeit kam aber zu spät.,K 5.3,participant_128,1.0,Juli,1.53125,-0.53125
Das ist seine Art von Wohltätig- und Öffentlichkeit.,K 5'.4,participant_128,1.0,Juli,1.53125,-0.53125
Die Probleme sind vor allem zeit- und rechtlicher Natur.,L 2.1,participant_128,1.0,Juli,1.53125,-0.53125
Die Landschaft dort ist herr- und friedlich.,L 2'.2,participant_128,1.0,Juli,1.53125,-0.53125
weil er nied- und behilflich ist.,L 5.3,participant_128,1.0,Juli,1.53125,-0.53125
Das war augenblick- und schließlich das Ende.,L 5'.4,participant_128,1.0,Juli,1.53125,-0.53125
Das Verhalten ist an Gemein- und Hässlichkeit nicht zu übertreffen.,Mis 3.3,participant_128,1.0,Juli,1.53125,-0.53125
Der Papst erfreut sich großer Herrlich- und Berühmtheit.,Mis 3'.4,participant_128,1.0,Juli,1.53125,-0.53125
Sie schwören einander Kühn- und Brüderlichkeit.,Mis 6.5,participant_128,1.0,Juli,1.53125,-0.53125
Die Oma hat viel Zärtlich- und Weisheit für ihre Enkel.,Mis 6'.6,participant_128,1.0,Juli,1.53125,-0.53125
Bischöfe bestimmten die gött- und weltliche Ordnung.,Mix 3.3,participant_128,1.0,Juli,1.53125,-0.53125
Oft ist mit dem mensch- und männlichen Körper ein und das Selbe gemeint.,Mix 3'.4,participant_128,1.0,Juli,1.53125,-0.53125
Ihre Worte waren ähn- und deutlich.,Mix 6.5,participant_128,1.0,Juli,1.53125,-0.53125
Die Arbeitsleistung ist ordent- und gewöhnlich.,Mix 6'.6,participant_128,1.0,Juli,1.53125,-0.53125
In der Gegend ist es länd- und eigentümlich.,U 1.7,participant_128,1.0,Juli,1.53125,-0.53125
In diesem Zustand ist die Deutsche Bahn leider weder nütz- noch pünktlich.,U 1'.8,participant_128,1.0,Juli,1.53125,-0.53125
Es schmeckt köst- und vorzüglich.,U 4.1,participant_128,1.0,Juli,1.53125,-0.53125
Sie fördert und fordert ihn zärt- und nachdrücklich.,U 4'.2,participant_128,1.0,Juli,1.53125,-0.53125
Nudeln sind der neue Reis.,Deutsch_test_2,participant_128,6.0,Juli,1.53125,4.46875
Reis ist die neuen Nudeln.,Deutsch_test_3,participant_128,1.0,Juli,1.53125,-0.53125
Der Teppichhändler hat dem Prinzen den großen und schönen Teppich verkauft.,F,participant_129,7.0,August,3.21875,3.78125
"Auf dem Heimweg denkt sie, hat das Kind den Schlüssel verloren.",F,participant_129,3.0,August,3.21875,-0.21875
Die Fotografen haben einander es als schönstes und bestes Foto bestätigt.,F,participant_129,1.0,August,3.21875,-2.21875
Bei dem Regen die Familie macht bestimmt kein Picknick.,F,participant_129,2.0,August,3.21875,-1.21875
Die Blume wurde gegen gegossen.,F,participant_129,1.0,August,3.21875,-2.21875
Der Mann schenkt seiner Verlobten eine rote Rose.,F,participant_129,7.0,August,3.21875,3.78125
Die Echt- und Nettheit seiner Reaktion hat allen gefallen.,H 1.6,participant_129,3.0,August,3.21875,-0.21875
Allen war die Feig- und Dummheit ihrer Entscheidung klar.,H 1'.7,participant_129,6.0,August,3.21875,2.78125
Die Gesamt- und Allgemeinheit der Regeln spricht dafür.,H 4.4,participant_129,7.0,August,3.21875,3.78125
Sie strahlen Erhaben- und Vergangenheit aus.,H 4'.1,participant_129,7.0,August,3.21875,3.78125
Die Ehrlich- und Freundlichkeit ihrer Worte war rührend.,K 2.8,participant_129,7.0,August,3.21875,3.78125
Das Hotel erfüllte ihre Erwartungen und überzeugte vor allem durch Gemütlich- und Sauberkeit.,K 2'.1,participant_129,7.0,August,3.21875,3.78125
Jede Zeit kommt mit einer eigenen Idee von Männlich- und Weiblichkeit.,K 5.2,participant_129,7.0,August,3.21875,3.78125
Die Erkenntnis über seine Gleichgültig- und Eitelkeit kam aber zu spät.,K 5'.3,participant_129,5.0,August,3.21875,1.78125
Das war absicht- und sicherlich der Nachbar.,L 2.8,participant_129,1.0,August,3.21875,-2.21875
Die Probleme sind vor allem recht- und zeitlicher Natur.,L 2'.1,participant_129,3.0,August,3.21875,-0.21875
Seine Antwort war ehr- und erstaunlich.,L 5.2,participant_129,1.0,August,3.21875,-2.21875
weil er behilf- und niedlich ist.,L 5'.3,participant_129,1.0,August,3.21875,-2.21875
Dafür sind Verbunden- und Großzügigkeit entscheidend.,Mis 3.2,participant_129,1.0,August,3.21875,-2.21875
Das Verhalten ist an Hässlich- und Gemeinheit nicht zu übertreffen.,Mis 3'.3,participant_129,1.0,August,3.21875,-2.21875
Vor lauter Beschränkt- und Bitterkeit hat der Nachbar keinen Kontakt zu den anderen.,Mis 6.4,participant_129,3.0,August,3.21875,-0.21875
Sie schwören einander Brüderlich- und Kühnheit.,Mis 6'.5,participant_129,1.0,August,3.21875,-2.21875
Die Bezahlung vieler Berufe ist kümmer- und leidlich.,Mix 3.2,participant_129,2.0,August,3.21875,-1.21875
Bischöfe bestimmten die welt- und göttliche Ordnung.,Mix 3'.3,participant_129,7.0,August,3.21875,3.78125
Der Auftritt war lächer- und peinlich.,Mix 6.4,participant_129,2.0,August,3.21875,-1.21875
Ihre Worte waren deut- und ähnlich.,Mix 6'.5,participant_129,1.0,August,3.21875,-2.21875
Besonders Mikroplastik ist künst- und schädlich.,U 1.6,participant_129,3.0,August,3.21875,-0.21875
In der Gegend hier ist es eigentüm- und ländlich.,U 1'.7,participant_129,2.0,August,3.21875,-1.21875
Der Tiger hat den Pfleger vorsätz- und plötzlich angegriffen.,U 4.4,participant_129,1.0,August,3.21875,-2.21875
Es schmeckt vorzüg- und köstlich.,U 4'.1,participant_129,1.0,August,3.21875,-2.21875
Nudeln sind der neue Reis.,Deutsch_test_2,participant_129,1.0,August,3.21875,-2.21875
Reis ist die neuen Nudeln.,Deutsch_test_3,participant_129,1.0,August,3.21875,-2.21875
Die Katze wurde unter gestreichelt und gekrault.,F,participant_130,1.0,Dezember,2.28125,-1.28125
Der Polizist hat den komplizierten Fall endlich gelöst.,F,participant_130,7.0,Dezember,2.28125,4.71875
"Er weiß, der Mann hat das neue und teure Handy geklaut.",F,participant_130,5.0,Dezember,2.28125,2.71875
"In Bayern meinte sie, haben die Lehrer die Schüler mehr unter Kontrolle.",F,participant_130,4.0,Dezember,2.28125,1.71875
"Ihr fahrt gerne in die Berge, obwohl ihr wohnt sehr nahe am Meer.",F,participant_130,2.0,Dezember,2.28125,-0.28125
Da gelacht rüber hat der Moderator natürlich nicht.,F,participant_130,1.0,Dezember,2.28125,-1.28125
Ihr Auftreten strahlt Gewiss- und Sicherheit aus.,H 1.2,participant_130,1.0,Dezember,2.28125,-1.28125
Der Diamant ist von seltener Rein- und Schönheit.,H 1'.3,participant_130,7.0,Dezember,2.28125,4.71875
Eine Ausbildung in Frankreich steht für Gewandt- und Kultiviertheit.,H 4.8,participant_130,3.0,Dezember,2.28125,0.71875
Sie strahlen Erhaben- und Vergangenheit aus.,H 4'.1,participant_130,3.0,Dezember,2.28125,0.71875
Sie legt viel wert auf Höflich- und Pünktlichkeit.,K 2.4,participant_130,4.0,Dezember,2.28125,1.71875
Die Wichtig- und Richtigkeit der Erkenntnisse kann nicht oft genug betont werden.,K 2'.5,participant_130,6.0,Dezember,2.28125,3.71875
Jede Zeit kommt mit einer eigenen Idee von Männlich- und Weiblichkeit.,K 5.2,participant_130,5.0,Dezember,2.28125,2.71875
Die Erkenntnis über seine Gleichgültig- und Eitelkeit kam aber zu spät.,K 5'.3,participant_130,1.0,Dezember,2.28125,-1.28125
Ihre Beziehung ist immer noch leidenschaft- und glücklich.,L 2.4,participant_130,1.0,Dezember,2.28125,-1.28125
Der Schraubenzieher ist hand- und dünnlich.,L 2'.5,participant_130,1.0,Dezember,2.28125,-1.28125
Seine Antwort war ehr- und erstaunlich.,L 5.2,participant_130,1.0,Dezember,2.28125,-1.28125
weil er behilf- und niedlich ist.,L 5'.3,participant_130,1.0,Dezember,2.28125,-1.28125
Die gute Zusammenarbeit basiert auf Vertraut- und Einigkeit.,Mis 3.6,participant_130,1.0,Dezember,2.28125,-1.28125
Die Zuständig- und Begebenheiten in dem Fall sind noch nicht geklärt.,Mis 3'.7,participant_130,1.0,Dezember,2.28125,-1.28125
Vor lauter Beschränkt- und Bitterkeit hat der Nachbar keinen Kontakt zu den anderen.,Mis 6.4,participant_130,1.0,Dezember,2.28125,-1.28125
Sie strahlt Glaubwürdig- und Selbstsicherheit aus.,Mis 6'.1,participant_130,1.0,Dezember,2.28125,-1.28125
Sie treffen sich täg- und heimlich.,Mix 3.6,participant_130,1.0,Dezember,2.28125,-1.28125
Die Durchsuchung Mitten in der Nacht war amt- und gründlich.,Mix 3'.7,participant_130,1.0,Dezember,2.28125,-1.28125
Der Auftritt war lächer- und peinlich.,Mix 6.4,participant_130,1.0,Dezember,2.28125,-1.28125
Nachhaltig zu leben ist verantwort- und natürlich.,Mix 6'.1,participant_130,1.0,Dezember,2.28125,-1.28125
wenn die jähr- und tödliche Malariasaison wieder vor der Tür steht.,U 1.2,participant_130,1.0,Dezember,2.28125,-1.28125
Der Pfarrer hat sie irrtüm- und kürzlich kontaktiert.,U 1'.3,participant_130,1.0,Dezember,2.28125,-1.28125
Seine Verteidigung war widersprüch- und jämmerlich.,U 4.8,participant_130,1.0,Dezember,2.28125,-1.28125
Es schmeckt vorzüg- und köstlich.,U 4'.1,participant_130,1.0,Dezember,2.28125,-1.28125
Nudeln sind der neue Reis.,Deutsch_test_2,participant_130,6.0,Dezember,2.28125,3.71875
Reis ist die neuen Nudeln.,Deutsch_test_3,participant_130,1.0,Dezember,2.28125,-1.28125
Die Mutter hat dem Sohn es verboten.,F,participant_131,2.0,April,4.1875,-2.1875
"Der Chemiker meint er, dass den Pharmakonzern belogen hat.",F,participant_131,6.0,April,4.1875,1.8125
Die Sitzung wurde aus vertagt.,F,participant_131,2.0,April,4.1875,-2.1875
Auf dem Markt verkaufen viele Bauern Obst und Gemüse.,F,participant_131,7.0,April,4.1875,2.8125
Was hat der Verkäufer welchem Kunden geraten?,F,participant_131,6.0,April,4.1875,1.8125
"In der Elbe glaubt sie, hat der Fischer das kleine und flinke Boot versenkt.",F,participant_131,2.0,April,4.1875,-2.1875
Ihr Auftreten strahlt Gewiss- und Sicherheit aus.,H 1.2,participant_131,6.0,April,4.1875,1.8125
Der Diamant ist von seltener Rein- und Schönheit.,H 1'.3,participant_131,3.0,April,4.1875,-1.1875
Die Gesamt- und Allgemeinheit der Regeln spricht dafür.,H 4.4,participant_131,5.0,April,4.1875,0.8125
"Er glaubt, dass die Staatsanwälte zu viel Verschwiegen- und Befangenheit an den Tag legen.",H 4'.5,participant_131,3.0,April,4.1875,-1.1875
Sie legt viel wert auf Höflich- und Pünktlichkeit.,K 2.4,participant_131,3.0,April,4.1875,-1.1875
Das Hotel erfüllte ihre Erwartungen und überzeugte vor allem durch Gemütlich- und Sauberkeit.,K 2'.1,participant_131,6.0,April,4.1875,1.8125
Die Ordensleute erzählen immer von Momenten der Glückselig- und Barmherzigkeit.,K 5.6,participant_131,4.0,April,4.1875,-0.1875
Die Unfähig- und Feindseligkeit der Angestellten ist alles andere als guter Service.,K 5'.7,participant_131,1.0,April,4.1875,-3.1875
Ihre Beziehung ist immer noch leidenschaft- und glücklich.,L 2.4,participant_131,4.0,April,4.1875,-0.1875
Die Probleme sind vor allem recht- und zeitlicher Natur.,L 2'.1,participant_131,5.0,April,4.1875,0.8125
Am Anfang hat der Wein abscheu- und widerlich geschmeckt.,L 5.6,participant_131,2.0,April,4.1875,-2.1875
Wir verwenden ausdrück- und ausschließlich regionale Zutaten.,L 5'.7,participant_131,6.0,April,4.1875,1.8125
Dafür sind Verbunden- und Großzügigkeit entscheidend.,Mis 3.2,participant_131,5.0,April,4.1875,0.8125
Das Verhalten ist an Hässlich- und Gemeinheit nicht zu übertreffen.,Mis 3'.3,participant_131,3.0,April,4.1875,-1.1875
Viele werden sich im Alter ihrer Unzufrieden- und Sterblichkeit bewusst.,Mis 6.8,participant_131,2.0,April,4.1875,-2.1875
Sie strahlt Glaubwürdig- und Selbstsicherheit aus.,Mis 6'.1,participant_131,6.0,April,4.1875,1.8125
Die Bezahlung vieler Berufe ist kümmer- und leidlich.,Mix 3.2,participant_131,6.0,April,4.1875,1.8125
Bischöfe bestimmten die welt- und göttliche Ordnung.,Mix 3'.3,participant_131,6.0,April,4.1875,1.8125
Der ganze Papierkram für ein Visum ist umständ- und erforderlich.,Mix 6.8,participant_131,2.0,April,4.1875,-2.1875
Nachhaltig zu leben ist verantwort- und natürlich.,Mix 6'.1,participant_131,6.0,April,4.1875,1.8125
wenn die jähr- und tödliche Malariasaison wieder vor der Tür steht.,U 1.2,participant_131,7.0,April,4.1875,2.8125
Der Pfarrer hat sie irrtüm- und kürzlich kontaktiert.,U 1'.3,participant_131,4.0,April,4.1875,-0.1875
Der Tiger hat den Pfleger vorsätz- und plötzlich angegriffen.,U 4.4,participant_131,2.0,April,4.1875,-2.1875
Sie stellen grundsätz- und hauptsächlich Frauen ein.,U 4'.5,participant_131,7.0,April,4.1875,2.8125
Nudeln sind der neue Reis.,Deutsch_test_2,participant_131,2.0,April,4.1875,-2.1875
Reis ist die neuen Nudeln.,Deutsch_test_3,participant_131,3.0,April,4.1875,-1.1875
Der Kaiser hat dem Fürsten den berühmten und begabten Maler empfohlen.,F,participant_132,6.0,Februar,1.9375,4.0625
"Im Einkaufszentrum meint sie, hat der Ladenbesitzer den eleganten und gut geführten Laden geschlossen.",F,participant_132,1.0,Februar,1.9375,-0.9375
Die Bergführer haben einander ihn als kompetenten und zuverlässigen Begleiter empfohlen.,F,participant_132,1.0,Februar,1.9375,-0.9375
Beim Stammtisch die drei Freunde spielen mit Vorliebe Skat und Würfeln.,F,participant_132,2.0,Februar,1.9375,0.0625
Die Suppe wurde gegen versalzen.,F,participant_132,1.0,Februar,1.9375,-0.9375
Der Patient hat den geldgierigen und unprofessionellen Zahnarzt überlistet.,F,participant_132,2.0,Februar,1.9375,0.0625
Das ist die Verrückt- und Besonderheit ihrer Herangehensweise.,H 1.5,participant_132,2.0,Februar,1.9375,0.0625
Die Klar- und Einfachheit der Lösung erstaunte alle.,H 1'.1,participant_132,5.0,Februar,1.9375,3.0625
Eigenschaften wie Lüstern- und Verderbtheit sind absolut unpassend.,H 4.6,participant_132,2.0,Februar,1.9375,0.0625
Der Richter vermittelt mit Rechtschaffen- und Besonnenheit.,H 4'.7,participant_132,2.0,Februar,1.9375,0.0625
Fachleute waren sich uneinig über die Möglich- und Wahrscheinlichkeit eines Wahlsieges.,K 2.2,participant_132,3.0,Februar,1.9375,1.0625
Den Redakteur würde ein Mangel an Aufrichtig- und Aufmerksamkeit am meisten stören.,K 2'.3,participant_132,2.0,Februar,1.9375,0.0625
Für eine Sekunde war der Zauber von Unsterblich- und Unendlichkeit zu spüren.,K 5.8,participant_132,1.0,Februar,1.9375,-0.9375
Der Autounfall ist auf Unzurechnungsfähig- und Fahrlässigkeit zurückzuführen.,K 5'.1,participant_132,1.0,Februar,1.9375,-0.9375
Die Landschaft dort ist fried- und herrlich.,L 2.2,participant_132,2.0,Februar,1.9375,0.0625
Das Lachen ist herz- und kindlich.,L 2'.3,participant_132,2.0,Februar,1.9375,0.0625
Selbst für erfahrene Rettungskräfte war der Anblick entsetz- und sonderlich.,L 5.8,participant_132,1.0,Februar,1.9375,-0.9375
Die Neuigkeiten sind für sie gleichzeitig bedroh- und erfreulich.,L 5'.1,participant_132,1.0,Februar,1.9375,-0.9375
Der Papst erfreut sich großer Berühmt- und Herrlichkeit.,Mis 3.4,participant_132,2.0,Februar,1.9375,0.0625
Die Welthungerhilfe betont die Notwendig- und Knappheit von Lebensmitteln.,Mis 3'.5,participant_132,1.0,Februar,1.9375,-0.9375
Für Kinder sind Geborgen- und Unabhängigkeit wichtig.,Mis 6.2,participant_132,2.0,Februar,1.9375,0.0625
Die Autorin wirkte sehr sympathisch durch ihre Liebenswürdig- und Bescheidenheit.,Mis 6'.3,participant_132,1.0,Februar,1.9375,-0.9375
Oft ist mit dem männ- und menschlichen Körper ein und das Selbe gemeint.,Mix 3.4,participant_132,1.0,Februar,1.9375,-0.9375
Im Kindergarten wird alles schwester- und brüderlich geteilt.,Mix 3'.5,participant_132,1.0,Februar,1.9375,-0.9375
Mutproben sind gefähr- und schrecklich.,Mix 6.2,participant_132,2.0,Februar,1.9375,0.0625
Sie hat aber wirk- und tatsächlich mehr verlangt.,Mix 6'.3,participant_132,1.0,Februar,1.9375,-0.9375
Sie ist eher so der häus- und ängstliche Typ.,U 1.4,participant_132,1.0,Februar,1.9375,-0.9375
Die Lieder sind fröh- und tröstlich.,U 1'.1,participant_132,6.0,Februar,1.9375,4.0625
Die Bank will buchstäb- und zusätzlich hundert tausend Euro.,U 4.6,participant_132,1.0,Februar,1.9375,-0.9375
Eine Zeitung ist ein auf die Gegenwart alltäg- und bezügliches Medium.,U 4'.7,participant_132,1.0,Februar,1.9375,-0.9375
Nudeln sind der neue Reis.,Deutsch_test_2,participant_132,3.0,Februar,1.9375,1.0625
Reis ist die neuen Nudeln.,Deutsch_test_3,participant_132,2.0,Februar,1.9375,0.0625
Der Kaiser hat dem Fürsten den berühmten und begabten Maler empfohlen.,F,participant_133,6.0,Februar,4.15625,1.84375
"Im Einkaufszentrum meint sie, hat der Ladenbesitzer den eleganten und gut geführten Laden geschlossen.",F,participant_133,4.0,Februar,4.15625,-0.15625
Die Bergführer haben einander ihn als kompetenten und zuverlässigen Begleiter empfohlen.,F,participant_133,4.0,Februar,4.15625,-0.15625
Beim Stammtisch die drei Freunde spielen mit Vorliebe Skat und Würfeln.,F,participant_133,2.0,Februar,4.15625,-2.15625
Die Suppe wurde gegen versalzen.,F,participant_133,1.0,Februar,4.15625,-3.15625
Der Patient hat den geldgierigen und unprofessionellen Zahnarzt überlistet.,F,participant_133,5.0,Februar,4.15625,0.84375
Das ist die Verrückt- und Besonderheit ihrer Herangehensweise.,H 1.5,participant_133,4.0,Februar,4.15625,-0.15625
Die Klar- und Einfachheit der Lösung erstaunte alle.,H 1'.1,participant_133,7.0,Februar,4.15625,2.84375
Eigenschaften wie Lüstern- und Verderbtheit sind absolut unpassend.,H 4.6,participant_133,4.0,Februar,4.15625,-0.15625
Der Richter vermittelt mit Rechtschaffen- und Besonnenheit.,H 4'.7,participant_133,6.0,Februar,4.15625,1.84375
Fachleute waren sich uneinig über die Möglich- und Wahrscheinlichkeit eines Wahlsieges.,K 2.2,participant_133,7.0,Februar,4.15625,2.84375
Den Redakteur würde ein Mangel an Aufrichtig- und Aufmerksamkeit am meisten stören.,K 2'.3,participant_133,6.0,Februar,4.15625,1.84375
Für eine Sekunde war der Zauber von Unsterblich- und Unendlichkeit zu spüren.,K 5.8,participant_133,7.0,Februar,4.15625,2.84375
Der Autounfall ist auf Unzurechnungsfähig- und Fahrlässigkeit zurückzuführen.,K 5'.1,participant_133,6.0,Februar,4.15625,1.84375
Die Landschaft dort ist fried- und herrlich.,L 2.2,participant_133,2.0,Februar,4.15625,-2.15625
Das Lachen ist herz- und kindlich.,L 2'.3,participant_133,5.0,Februar,4.15625,0.84375
